id,title,timestamp,subjects,geo_areas,csv_url,committee_labels,committee_codes,policy_area
153308,Ro-ro passenger ships: stability requirements,2023-03-14T12:15:00,Maritime transport: passengers and freight; Maritime safety,,https://howtheyvote.eu/api/votes/153308.csv,Transport and Tourism,TRAN,Transport and Tourism
153309,EGF/2022/002 BE/TNT,2023-03-14T12:14:18,"Transport undertakings, transport industry employees; Industrial restructuring, job losses, redundancies, relocations, Globalisation Adjustment Fund (EGF); 2023 budget",Belgium,https://howtheyvote.eu/api/votes/153309.csv,Budgets,BUDG,Budgets
153310,Policy Coherence for Development,2023-03-14T12:43:43,Development cooperation,,https://howtheyvote.eu/api/votes/153310.csv,Development,DEVE,Development
153316,"Land use, land use change and forestry (LULUCF)",2023-03-14T12:17:10,"Forestry policy; Set-aside and conversion of land; Atmospheric pollution, motor vehicle pollution; Climate policy, climate change, ozone layer; International and regional environment protection measures and agreements",,https://howtheyvote.eu/api/votes/153316.csv,"Environment, Climate and Food Safety",ENVI,"Environment, Climate and Food Safety"
153359,Activities of the European Ombudsman - annual report 2021,2023-03-14T12:42:08,European Ombudsman,,https://howtheyvote.eu/api/votes/153359.csv,Petitions,PETI,Petitions
153374,Data Act,2023-03-14T12:39:48,"Public access to information and documents, administrative practice; Protection of privacy and data protection; Free movement of services, freedom to provide; Information and communication technologies, digital technologies; International information networks and society, internet; Innovation",,https://howtheyvote.eu/api/votes/153374.csv,"Industry, Research and Energy",ITRE,"Industry, Research and Energy"
153485,Energy performance of buildings,2023-03-14T12:35:43,Building industry; Energy efficiency,,https://howtheyvote.eu/api/votes/153485.csv,"Industry, Research and Energy",ITRE,"Industry, Research and Energy"
153629,Revision of the Market Stability Reserve for the EU Emissions Trading System,2023-03-14T12:17:55,"Atmospheric pollution, motor vehicle pollution; Climate policy, climate change, ozone layer; International and regional environment protection measures and agreements",,https://howtheyvote.eu/api/votes/153629.csv,"Environment, Climate and Food Safety",ENVI,"Environment, Climate and Food Safety"
153640,"The draft Commission implementing decision authorising the placing on the market of products containing, consisting of or produced from genetically modified oilseed rape MON 94100 (MON-941ØØ-2) pursuant to Regulation (EC) No 1829/2003 of the European Parliament and of the Council",2023-03-14T12:14:40,"Agro-genetics, GMOs",,https://howtheyvote.eu/api/votes/153640.csv,,,
152523,European Central Bank - annual report 2022,2023-02-16T12:52:53,"European Central Bank (ECB), ESCB",,https://howtheyvote.eu/api/votes/152523.csv,Economic and Monetary Affairs,ECON,Economic and Monetary Affairs
152881,Transitional provisions for certain medical devices and in vitro diagnostic medical devices,2023-02-16T12:08:06,,,https://howtheyvote.eu/api/votes/152881.csv,,,
153055,"Violence against opposition activists in Equatorial Guinea, notably the case of Julio Obama Mefuman",2023-02-16T12:05:24,"Third-country political situation, local and regional conflicts; Fundamental freedoms, human rights, democracy in general",Equatorial Guinea,https://howtheyvote.eu/api/votes/153055.csv,,,
153059,The inhuman imprisonment conditions of Alexei Navalny,2023-02-16T12:06:52,"Fundamental freedoms, human rights, democracy in general",Russia,https://howtheyvote.eu/api/votes/153059.csv,,,
153081,One year of Russia’s invasion and war of aggression against Ukraine,2023-02-16T12:48:22,"Third-country political situation, local and regional conflicts","Russia, Ukraine",https://howtheyvote.eu/api/votes/153081.csv,,,
153099,The establishment of an independent EU ethics body,2023-02-16T12:43:23,"Institutions of the Union; Interinstitutional relations, subsidiarity, proportionality, comitology",,https://howtheyvote.eu/api/votes/153099.csv,,,
153139,Following up on measures requested by Parliament to strengthen the integrity of the European institutions,2023-02-16T12:40:10,"Institutions of the Union; Interinstitutional relations, subsidiarity, proportionality, comitology",,https://howtheyvote.eu/api/votes/153139.csv,,,
153265,"An EU strategy to boost industrial competitiveness, trade and quality jobs",2023-02-16T12:30:46,"Industrial policy; Industrial competitiveness; Employment policy, action to combat unemployment; Common commercial policy in general",,https://howtheyvote.eu/api/votes/153265.csv,,,
152506,Amendments to the European Long-Term Investment Funds (ELTIFs) Regulation,2023-02-15T15:12:49,"Securities and financial markets, stock exchange, CIUTS, investments; Insurance, pension funds; Financial services, financial reporting and auditing; Financial supervision",,https://howtheyvote.eu/api/votes/152506.csv,Economic and Monetary Affairs,ECON,Economic and Monetary Affairs
152509,Joint Undertakings under Horizon Europe: Chips Joint Undertaking,2023-02-15T15:15:00,"Electronics, electrotechnical industries, ICT, robotics; EC, EU framework programme; Innovation; Agencies and bodies of the EU",,https://howtheyvote.eu/api/votes/152509.csv,"Industry, Research and Energy",ITRE,"Industry, Research and Energy"
152564,Council of Europe Convention on preventing and combating violence against women and domestic violence: EU accession,2023-02-15T15:21:21,"Women condition and rights; Action to combat violence, trafficking in human beings and migrant smuggling",,https://howtheyvote.eu/api/votes/152564.csv,"Women’s Rights and Gender Equality;Civil Liberties, Justice and Home Affairs",FEMM;LIBE,Women’s Rights and Gender Equality
152566,"Protocol to the EC/Korea Cooperation Agreement on a Civil Global Navigation Satellite System (GNSS): accession of Bulgaria, Croatia and Romania",2023-02-15T15:14:40,"Communications by satellite; Aeronautical industry, aerospace industry; Scientific and technological cooperation and agreements","Bulgaria, Croatia, South Korea, Romania",https://howtheyvote.eu/api/votes/152566.csv,"Industry, Research and Energy",ITRE,"Industry, Research and Energy"
152567,EU/North Macedonia Agreement: operational activities carried out by the European Border and Coast Guard Agency in the Republic of North Macedonia,2023-02-15T15:13:20,"External borders crossing and controls, visas; Asylum, refugees, displaced persons; Asylum, Migration and Integration Fund (AMIF)",North Macedonia,https://howtheyvote.eu/api/votes/152567.csv,"Civil Liberties, Justice and Home Affairs",LIBE,"Civil Liberties, Justice and Home Affairs"
152568,Authorising Poland to ratify the amendment to the Convention on the Conservation and Management of Pollock Resources in the Central Bering Sea,2023-02-15T15:14:14,"Fish stocks, conservation of fishery resources; Management of fisheries, fisheries, fishing grounds; Fisheries agreements and cooperation",Poland,https://howtheyvote.eu/api/votes/152568.csv,Fisheries,PECH,Fisheries
152767,Situation of the former President of Georgia Mikheil Saakashvili,2023-02-15T15:16:09,"Third-country political situation, local and regional conflicts",Georgia,https://howtheyvote.eu/api/votes/152767.csv,,,
152507,Electoral rights of mobile Union citizens in municipal elections,2023-02-14T12:22:02,"Political rights, right to vote and to stand in elections",,https://howtheyvote.eu/api/votes/152507.csv,"Civil Liberties, Justice and Home Affairs",LIBE,"Civil Liberties, Justice and Home Affairs"
152508,"EU/Guyana Voluntary Partnership Agreement: forest law enforcement, governance and trade in timber products to the EU",2023-02-14T12:19:28,"Forestry policy; Protection of natural resources: fauna, flora, nature, wildlife, countryside; biodiversity; International and regional environment protection measures and agreements; Export/import control, trade defence, trade barriers; Bilateral economic and trade agreements and relations; Financial and technical cooperation and assistance",Guyana,https://howtheyvote.eu/api/votes/152508.csv,International Trade,INTA,International Trade
152544,CO2 emission standards for cars and vans,2023-02-14T12:22:51,"Standardisation, EC/EU standards and trade mark, certification, compliance; Road transport: passengers and freight; Motor industry, cycle and motorcycle, commercial and agricultural vehicles; Atmospheric pollution, motor vehicle pollution",,https://howtheyvote.eu/api/votes/152544.csv,"Environment, Climate and Food Safety",ENVI,"Environment, Climate and Food Safety"
152547,Union Secure Connectivity Programme 2023-2027,2023-02-14T12:18:33,Communications by satellite,,https://howtheyvote.eu/api/votes/152547.csv,"Industry, Research and Energy",ITRE,"Industry, Research and Energy"
152552,Electoral rights of mobile Union citizens in European Parliament elections,2023-02-14T12:21:37,"Political rights, right to vote and to stand in elections; Elections, direct universal suffrage",,https://howtheyvote.eu/api/votes/152552.csv,Constitutional Affairs,AFCO,Constitutional Affairs
152554,REPowerEU chapters in recovery and resilience plans,2023-02-14T12:20:08,"Oil industry, motor fuels; Gas, electricity, natural gas, biogas; Security of energy supply; Cooperation and agreements for energy; Structural funds, investment funds in general, programmes",,https://howtheyvote.eu/api/votes/152554.csv,Budgets;Economic and Monetary Affairs,BUDG;ECON,Budgets
152565,"EU/Guyana Voluntary Partnership Agreement: forest law enforcement, governance and trade in timber products to the EU",2023-02-14T12:19:09,"Forestry policy; Protection of natural resources: fauna, flora, nature, wildlife, countryside; biodiversity; International and regional environment protection measures and agreements; Export/import control, trade defence, trade barriers; Bilateral economic and trade agreements and relations; Financial and technical cooperation and assistance",Guyana,https://howtheyvote.eu/api/votes/152565.csv,International Trade,INTA,International Trade
152653,Union's rights in enforcing and implementing the UK Withdrawal Agreement and the EU-UK Trade and Cooperation Agreement,2023-02-14T12:18:10,Bilateral economic and trade agreements and relations; Relations with third countries,United Kingdom,https://howtheyvote.eu/api/votes/152653.csv,Constitutional Affairs;Foreign Affairs;International Trade,AFCO;AFET;INTA,Constitutional Affairs
151591,Revision of European Works Councils Directive,2023-02-02T11:26:11,"Worker information, participation, trade unions, works councils",,https://howtheyvote.eu/api/votes/151591.csv,Employment and Social Affairs,EMPL,Employment and Social Affairs
152282,Conservation of the Southern Bluefin Tuna: conservation and management measures,2023-02-02T11:06:16,"Fish stocks, conservation of fishery resources; Fisheries inspectorate, surveillance of fishing vessels and areas; Fisheries agreements and cooperation",,https://howtheyvote.eu/api/votes/152282.csv,Fisheries,PECH,Fisheries
152302,European system of national and regional accounts in the European Union (ESA 2010),2023-02-02T11:05:49,"Convergence of economic policies,  public deficit, interest rates; European statistical legislation; Financing of the budget, own resources",,https://howtheyvote.eu/api/votes/152302.csv,Economic and Monetary Affairs,ECON,Economic and Monetary Affairs
152345,Improving working conditions of persons working through digital labour platforms,2023-02-02T11:11:31,"Information and communication technologies, digital technologies; Workforce, occupational mobility, job conversion, working conditions; Workers protection and rights, labour law",,https://howtheyvote.eu/api/votes/152345.csv,Employment and Social Affairs,EMPL,Employment and Social Affairs
152384,Transparency and targeting of political advertising,2023-02-02T11:16:55,"Protection of privacy and data protection; Free movement of services, freedom to provide; Consumer information, advertising, labelling",,https://howtheyvote.eu/api/votes/152384.csv,Internal Market and Consumer Protection,IMCO,Internal Market and Consumer Protection
152416,The preparation of the EU-Ukraine Summit,2023-02-02T11:31:20,Relations with central and eastern Europe,Ukraine,https://howtheyvote.eu/api/votes/152416.csv,,,
151570,Small-scale fisheries situation in the EU and future perspectives,2023-01-19T12:20:21,"Management of fisheries, fisheries, fishing grounds; Fishing industry and statistics, fishery products",,https://howtheyvote.eu/api/votes/151570.csv,Fisheries,PECH,Fisheries
151714,The control of the financial activities of the European Investment Bank – Annual Report 2021,2023-01-19T12:14:00,European Investment Bank (EIB),,https://howtheyvote.eu/api/votes/151714.csv,Budgetary Control,CONT,Budgetary Control
151811,The protection of the European Union’s financial interests – combating fraud – annual report 2021,2023-01-19T12:18:56,Protecting financial interests of the EU against fraud,,https://howtheyvote.eu/api/votes/151811.csv,Budgetary Control,CONT,Budgetary Control
152229,The storming of the Brazilian democratic institutions,2023-01-19T12:05:35,"Third-country political situation, local and regional conflicts",Brazil,https://howtheyvote.eu/api/votes/152229.csv,,,
152245,The establishment of a tribunal on the crime of aggression against Ukraine,2023-01-19T12:09:45,"Third-country political situation, local and regional conflicts","Russia, Ukraine",https://howtheyvote.eu/api/votes/152245.csv,,,
152265,"The situation of journalists in Morocco, notably the case of Omar Radi",2023-01-19T12:07:18,"Fundamental freedoms, human rights, democracy in general",Morocco,https://howtheyvote.eu/api/votes/152265.csv,,,
151561,Consumer protection in online video games: a European Single Market approach,2023-01-18T12:23:35,Consumers' protection in general,,https://howtheyvote.eu/api/votes/151561.csv,Internal Market and Consumer Protection,IMCO,Internal Market and Consumer Protection
151701,Implementation of the common foreign and security policy - annual report 2022,2023-01-18T12:38:53,Common foreign and security policy (CFSP),,https://howtheyvote.eu/api/votes/151701.csv,Foreign Affairs,AFET,Foreign Affairs
151771,Implementation of the common security and defence policy - annual report 2022,2023-01-18T12:48:31,"Common security and defence policy (CSDP); WEU, NATO",,https://howtheyvote.eu/api/votes/151771.csv,Foreign Affairs,AFET,Foreign Affairs
151796,Human rights and democracy in the world and the European Union’s policy on the matter - annual report 2022,2023-01-18T12:57:04,Human rights situation in the world,,https://howtheyvote.eu/api/votes/151796.csv,Foreign Affairs,AFET,Foreign Affairs
152032,The 30th anniversary of the single market: celebrating achievements and looking towards future developments,2023-01-18T12:23:13,"Internal market, single market",,https://howtheyvote.eu/api/votes/152032.csv,,,
151562,Taxation: rules to prevent the misuse of shell entities for tax purposes,2023-01-17T12:15:21,Taxation,,https://howtheyvote.eu/api/votes/151562.csv,Economic and Monetary Affairs,ECON,Economic and Monetary Affairs
151578,Shipments of waste,2023-01-17T12:14:13,"Waste management, domestic waste, packaging, light industrial waste; Dangerous substances, toxic and radioactive wastes (storage, transport); International and regional environment protection measures and agreements",,https://howtheyvote.eu/api/votes/151578.csv,"Environment, Climate and Food Safety",ENVI,"Environment, Climate and Food Safety"
151592,Amendments to Parliament’s Rules of Procedure concerning Rule 7 on defence of privileges and immunity and Rule 9 on procedures on immunity,2023-01-17T12:15:56,"Business of Parliament, procedure, sittings, rules of procedure",,https://howtheyvote.eu/api/votes/151592.csv,Constitutional Affairs,AFCO,Constitutional Affairs
151821,EU/New Zealand Agreement: exchange of personal data between Europol and New Zealand,2023-01-17T12:10:09,"Protection of privacy and data protection; Cooperation between administrations; Consumers' economic and legal interests; Relations with industrialised countries; Europol, CEPOL; Action to combat terrorism; Action to combat crime",New Zealand,https://howtheyvote.eu/api/votes/151821.csv,"Civil Liberties, Justice and Home Affairs",LIBE,"Civil Liberties, Justice and Home Affairs"
151822,Convention on Cybercrime on enhanced co-operation and disclosure of electronic evidence: Second Additional Protocol,2023-01-17T12:10:37,"Cybersecurity, cyberspace policy; International information networks and society, internet",,https://howtheyvote.eu/api/votes/151822.csv,"Civil Liberties, Justice and Home Affairs",LIBE,"Civil Liberties, Justice and Home Affairs"
150923,Deliberations of the Committee on Petitions in 2021,2022-12-15T12:29:44,"Right of petition; Committees, interparliamentary delegations",,https://howtheyvote.eu/api/votes/150923.csv,Petitions,PETI,Petitions
150935,Upscaling the 2021-2027 Multiannual Financial Framework: a resilient EU budget fit for new challenges,2022-12-15T12:28:40,"Financing of the budget, own resources; Financial regulations",,https://howtheyvote.eu/api/votes/150935.csv,Budgets,BUDG,Budgets
151387,90 years after the Holodomor: recognising the mass killing through starvation as genocide,2022-12-15T12:26:50,"Fundamental freedoms, human rights, democracy in general",Ukraine,https://howtheyvote.eu/api/votes/151387.csv,,,
151460,The case of human rights defender Abdulhadi Al-Khawaja in Bahrain,2022-12-15T12:14:31,"Fundamental freedoms, human rights, democracy in general",Bahrain,https://howtheyvote.eu/api/votes/151460.csv,,,
151508,Suspicions of corruption from Qatar and the broader need for transparency and accountability in the European institutions,2022-12-15T12:26:19,Action to combat economic fraud and corruption; Institutions of the Union,,https://howtheyvote.eu/api/votes/151508.csv,,,
150937,"Mobilisation of the European Union Solidarity Fund: assistance to Germany, Belgium, the Netherlands, Austria, Luxembourg, Spain and Greece further to natural disasters that took place in these countries in the course of 2021",2022-12-14T12:34:11,"Natural disasters, Solidarity Fund; 2021 budget; 2022 budget","Austria, Belgium, Germany, Greece, Luxembourg, Netherlands, Spain",https://howtheyvote.eu/api/votes/150937.csv,Budgets,BUDG,Budgets
150954,Implementation of the New European Agenda for Culture and the EU Strategy for International Cultural Relations,2022-12-14T13:08:53,"Cultural programmes and actions, assistance; Relations with third countries; Relations with/in the context of international organisations: UN, OSCE, OECD, Council of Europe, EBRD",,https://howtheyvote.eu/api/votes/150954.csv,Culture and Education,CULT,Culture and Education
150983,Annual implementing report on the EU association agreement with Georgia,2022-12-14T12:59:22,Bilateral economic and trade agreements and relations; European neighbourhood policy,Georgia,https://howtheyvote.eu/api/votes/150983.csv,Foreign Affairs,AFET,Foreign Affairs
151046,"Renewable Energy, Energy Performance of Buildings and Energy Efficiency Directives: amendments (REPowerEU)",2022-12-14T12:51:37,Building industry; Alternative and renewable energies; Energy efficiency,,https://howtheyvote.eu/api/votes/151046.csv,,,
150921,Towards equal rights for people with disabilities,2022-12-13T12:20:57,People with disabilities,,https://howtheyvote.eu/api/votes/150921.csv,"Civil Liberties, Justice and Home Affairs",LIBE,"Civil Liberties, Justice and Home Affairs"
150922,Civil aviation: repealing an obsolete directive,2022-12-13T12:18:50,Air transport and air freight; Noise pollution,,https://howtheyvote.eu/api/votes/150922.csv,Transport and Tourism,TRAN,Transport and Tourism
150924,"A long-term Vision for the EU's Rural Areas - Towards stronger, connected, resilient and prosperous rural areas by 2040",2022-12-13T12:21:45,"Rural development, European Agricultural Fund for Rural Development (EAFRD)",,https://howtheyvote.eu/api/votes/150924.csv,Agriculture and Rural Development,AGRI,Agriculture and Rural Development
150936,Administrative cooperation in the field of excise duties: exchange of information maintained in the electronic registers concerning economic operators who move excise goods between Member States for commercial purposes,2022-12-13T12:19:12,"Indirect taxation, VAT, excise duties; Cooperation between administrations",,https://howtheyvote.eu/api/votes/150936.csv,Economic and Monetary Affairs,ECON,Economic and Monetary Affairs
150939,Notification under the Carbon Offsetting and Reduction Scheme for International Aviation (CORSIA),2022-12-13T12:18:05,"Air transport and air freight; Air transport agreements and cooperation; Atmospheric pollution, motor vehicle pollution; Climate policy, climate change, ozone layer; International and regional environment protection measures and agreements",,https://howtheyvote.eu/api/votes/150939.csv,"Environment, Climate and Food Safety",ENVI,"Environment, Climate and Food Safety"
150940,Action plan to boost long distance and cross border passenger rail,2022-12-13T12:23:37,Rail transport: passengers and freight,,https://howtheyvote.eu/api/votes/150940.csv,Transport and Tourism,TRAN,Transport and Tourism
150985,"Application of Articles 93, 107 and 108 of the TFEU to certain categories of State aid in the rail, inland waterway and multimodal transport sector",2022-12-13T12:19:33,"State aids and interventions; Rail transport: passengers and freight; Inland waterway transport; Combined transport, multimodal transport",,https://howtheyvote.eu/api/votes/150985.csv,Economic and Monetary Affairs,ECON,Economic and Monetary Affairs
150992,Transport: repealing obsolete Regulations,2022-12-13T12:18:28,Transport policy in general; Rail transport: passengers and freight; Inland waterway transport; Road transport: passengers and freight; Transport statistics,,https://howtheyvote.eu/api/votes/150992.csv,Transport and Tourism,TRAN,Transport and Tourism
151088,"The draft Commission implementing decision renewing the authorisation for the placing on the market of products containing, consisting of or produced from genetically modified soybean A5547-127 (ACS-GMØØ6-4) pursuant to Regulation (EC) No 1829/2003 of the European Parliament and of the Council",2022-12-13T12:19:52,"Agro-genetics, GMOs",,https://howtheyvote.eu/api/votes/151088.csv,,,
150123,The future European Financial Architecture for Development,2022-11-24T12:13:20,Development cooperation; Financial and technical cooperation and assistance,,https://howtheyvote.eu/api/votes/150123.csv,Development,DEVE,Development
150136,2030 policy programme “Path to the Digital Decade”,2022-11-24T12:07:45,"Information and communication technologies, digital technologies; International information networks and society, internet",,https://howtheyvote.eu/api/votes/150136.csv,"Industry, Research and Energy",ITRE,"Industry, Research and Energy"
150204,Non-recognition of Russian travel documents issued in occupied foreign regions,2022-11-24T12:07:21,,Russia,https://howtheyvote.eu/api/votes/150204.csv,,,
150407,Multiannual financial framework for the years 2021 to 2027,2022-11-24T12:05:15,,,https://howtheyvote.eu/api/votes/150407.csv,,,
150545,Establishment of a diversified funding strategy as a general borrowing method,2022-11-24T12:05:32,,,https://howtheyvote.eu/api/votes/150545.csv,,,
150745,Assessment of Hungary's compliance with the rule of law conditions under the Conditionality Regulation and state of play of the Hungarian RRP,2022-11-24T12:18:37,"Principles common to the Member States, EU values; Budget of the Union",Hungary,https://howtheyvote.eu/api/votes/150745.csv,,,
150763,Human rights situation in Egypt,2022-11-24T12:29:01,"Fundamental freedoms, human rights, democracy in general; Human rights situation in the world",Egypt,https://howtheyvote.eu/api/votes/150763.csv,,,
150777,The Human rights situation in Afghanistan especially the deterioration of women´s rights and attacks against educational institutions,2022-11-24T12:10:19,"Fundamental freedoms, human rights, democracy in general; Human rights situation in the world",Afghanistan,https://howtheyvote.eu/api/votes/150777.csv,,,
150790,Forced displacement of people as a result of escalating conflict in Eastern Democratic Republic of Congo (DRC),2022-11-24T12:13:01,"Third-country political situation, local and regional conflicts; Human rights situation in the world",Congo,https://howtheyvote.eu/api/votes/150790.csv,,,
150795,'Macro-Financial Assistance+' instrument for providing support to Ukraine for 2023,2022-11-24T12:06:31,,Ukraine,https://howtheyvote.eu/api/votes/150795.csv,,,
150815,Outcome of the modernisation of the Energy Charter Treaty,2022-11-24T12:16:12,Energy policy; Cooperation and agreements for energy,,https://howtheyvote.eu/api/votes/150815.csv,,,
150067,Promoting regional stability and security in the broader Middle East region,2022-11-23T12:27:58,Relations with the countries of the Middle East,,https://howtheyvote.eu/api/votes/150067.csv,Foreign Affairs,AFET,Foreign Affairs
150117,Situation in Libya,2022-11-23T12:26:05,Relations with the countries of the Great Maghreb and Maghreb,Libya,https://howtheyvote.eu/api/votes/150117.csv,Foreign Affairs,AFET,Foreign Affairs
150122,System of own resources of the European Union,2022-11-23T12:08:19,"Financing of the budget, own resources",,https://howtheyvote.eu/api/votes/150122.csv,Budgets,BUDG,Budgets
150162,New EU strategy for enlargement,2022-11-23T12:17:47,Enlargement of the Union,,https://howtheyvote.eu/api/votes/150162.csv,Foreign Affairs,AFET,Foreign Affairs
