id,title,timestamp,subjects,geo_areas,csv_url,committee_labels,committee_codes,policy_area
166079,Amending Regulation (EC) No 223/2009 on European statistics,2024-03-13T12:40:11,European statistical legislation,,https://howtheyvote.eu/api/votes/166079.csv,Economic and Monetary Affairs,ECON,Economic and Monetary Affairs
166083,Amending the Directive on alternative dispute resolution for consumer disputes,2024-03-13T12:14:52,"Business policy, e-commerce, after-sales service, commercial distribution; Tourism; Consumers' economic and legal interests",,https://howtheyvote.eu/api/votes/166083.csv,Internal Market and Consumer Protection,IMCO,Internal Market and Consumer Protection
166086,Discontinuation of the European ODR Platform,2024-03-13T12:16:34,"Public access to information and documents, administrative practice; Cooperation between administrations; Information and communication technologies, digital technologies; International information networks and society, internet; Business policy, e-commerce, after-sales service, commercial distribution; Consumers' economic and legal interests; Judicial cooperation in civil and commercial matters",,https://howtheyvote.eu/api/votes/166086.csv,Internal Market and Consumer Protection,IMCO,Internal Market and Consumer Protection
166089,Asset recovery and confiscation,2024-03-13T12:18:56,"Action to combat crime; Action to combat economic fraud and corruption; Capital outflow, money laundering; Judicial cooperation in criminal matters",,https://howtheyvote.eu/api/votes/166089.csv,"Civil Liberties, Justice and Home Affairs",LIBE,"Civil Liberties, Justice and Home Affairs"
166131,Guidelines for the 2025 Budget – Section III,2024-03-13T17:43:14,2025 budget,,https://howtheyvote.eu/api/votes/166131.csv,Budgets,BUDG,Budgets
166145,European Semester for economic policy coordination: employment and social priorities for 2024,2024-03-13T17:30:50,"Social policy, social charter and protocol; Employment policy, action to combat unemployment; Convergence of economic policies,  public deficit, interest rates",,https://howtheyvote.eu/api/votes/166145.csv,Employment and Social Affairs,EMPL,Employment and Social Affairs
166171,Safety of toys and repealing Directive 2009/48/EC,2024-03-13T12:31:37,"Standardisation, EC/EU standards and trade mark, certification, compliance; Consumer security; Safety of products and services, product liability",,https://howtheyvote.eu/api/votes/166171.csv,Internal Market and Consumer Protection,IMCO,Internal Market and Consumer Protection
166172,A single application procedure for a single permit for third-country nationals to reside and work in the territory of a Member State and a common set of rights for third-country workers legally residing in a Member State (recast),2024-03-13T12:34:04,"Work, employment, wages and salaries: equal opportunities women and men, and for all; Workers protection and rights, labour law; Free movement and integration of third-country nationals; External borders crossing and controls, visas; Migration policy",,https://howtheyvote.eu/api/votes/166172.csv,"Civil Liberties, Justice and Home Affairs",LIBE,"Civil Liberties, Justice and Home Affairs"
166175,Type-approval of motor vehicles and engines with respect to their emissions and battery durability (Euro 7),2024-03-13T17:04:16,"Standardisation, EC/EU standards and trade mark, certification, compliance; Transport regulations, road safety, roadworthiness tests, driving licence; Motor industry, cycle and motorcycle, commercial and agricultural vehicles; Atmospheric pollution, motor vehicle pollution",,https://howtheyvote.eu/api/votes/166175.csv,"Environment, Climate and Food Safety",ENVI,"Environment, Climate and Food Safety"
166183,European Media Freedom Act,2024-03-13T12:13:46,"Internal market, single market; Audiovisual industry and services; Television, cable, digital, mobile; Radiocommunications, broadcasting; Press, media freedom and pluralism",,https://howtheyvote.eu/api/votes/166183.csv,Culture and Education,CULT,Culture and Education
166202,Compulsory licensing for crisis management and amending Regulation (EC) 816/2006,2024-03-13T12:21:46,"Industrial property, European patent, Community patent, design and pattern; Pharmaceutical products and industry",,https://howtheyvote.eu/api/votes/166202.csv,Legal Affairs,JURI,Legal Affairs
166241,Amending Directive 2008/98/EC on waste,2024-03-13T12:33:41,"Waste management, domestic waste, packaging, light industrial waste; Dangerous substances, toxic and radioactive wastes (storage, transport)",,https://howtheyvote.eu/api/votes/166241.csv,"Environment, Climate and Food Safety",ENVI,"Environment, Climate and Food Safety"
166258,Reporting requirements in the fields of road transport and aviation: decision,2024-03-13T12:35:20,"Air transport and air freight; Road transport: passengers and freight; Motor industry, cycle and motorcycle, commercial and agricultural vehicles; Energy efficiency; Atmospheric pollution, motor vehicle pollution; Dangerous substances, toxic and radioactive wastes (storage, transport)",,https://howtheyvote.eu/api/votes/166258.csv,Transport and Tourism,TRAN,Transport and Tourism
166259,Reporting requirements in the fields of road transport and aviation: regulation,2024-03-13T12:34:57,Air transport and air freight; Road transport: passengers and freight,,https://howtheyvote.eu/api/votes/166259.csv,Transport and Tourism,TRAN,Transport and Tourism
166260,Use of the Internal Market Information System and the Single Digital Gateway for the purposes of certain requirements laid down by the Directive on European cross-border associations,2024-03-13T12:19:21,"Public access to information and documents, administrative practice; Protection of privacy and data protection; Cooperation between administrations; Information and communication technologies, digital technologies; Social economy, mutual societies, cooperatives, associations; Social and community life, associations, foundations",,https://howtheyvote.eu/api/votes/166260.csv,Internal Market and Consumer Protection,IMCO,Internal Market and Consumer Protection
166262,European cross-border associations,2024-03-13T12:34:35,"Social economy, mutual societies, cooperatives, associations; Social and community life, associations, foundations",,https://howtheyvote.eu/api/votes/166262.csv,Legal Affairs,JURI,Legal Affairs
166335,Temporary trade-liberalisation measures supplementing trade concessions applicable to Moldovan products under the EU/Euratom/Moldova Association Agreement,2024-03-13T17:15:44,Bilateral economic and trade agreements and relations; European neighbourhood policy; Candidate countries,Moldova,https://howtheyvote.eu/api/votes/166335.csv,International Trade,INTA,International Trade
166551,Temporary trade-liberalisation measures supplementing trade concessions applicable to Ukrainian products under the EU/Euratom/Ukraine Association Agreement,2024-03-13T17:12:52,Bilateral economic and trade agreements and relations; European neighbourhood policy; Candidate countries,Ukraine,https://howtheyvote.eu/api/votes/166551.csv,International Trade,INTA,International Trade
166566,Closer ties between the EU and Armenia and the need for a peace agreement between Azerbaijan and Armenia,2024-03-13T17:46:51,"Peace preservation, humanitarian and rescue tasks, crisis management; Relations with Caucasus countries","Armenia, Azerbaijan",https://howtheyvote.eu/api/votes/166566.csv,,,
166038,Energy performance of buildings (recast),2024-03-12T13:30:58,Building industry; Energy efficiency,,https://howtheyvote.eu/api/votes/166038.csv,"Industry, Research and Energy",ITRE,"Industry, Research and Energy"
166040,Amending Regulation (EU) 2019/1009 as regards the digital labelling of EU fertilising products,2024-03-12T13:41:38,"Standardisation, EC/EU standards and trade mark, certification, compliance; Plant health legislation, organic farming, agro-genetics in general; Protection of natural resources: fauna, flora, nature, wildlife, countryside; biodiversity; Waste management, domestic waste, packaging, light industrial waste; Dangerous substances, toxic and radioactive wastes (storage, transport)",,https://howtheyvote.eu/api/votes/166040.csv,Internal Market and Consumer Protection,IMCO,Internal Market and Consumer Protection
166053,Liability for defective products,2024-03-12T13:41:14,"Consumers' economic and legal interests; Safety of products and services, product liability",,https://howtheyvote.eu/api/votes/166053.csv,Internal Market and Consumer Protection;Legal Affairs,IMCO;JURI,Internal Market and Consumer Protection
166073,Weights and dimensions of certain road vehicles,2024-03-12T13:24:43,"Road transport: passengers and freight; Transport regulations, road safety, roadworthiness tests, driving licence; Motor industry, cycle and motorcycle, commercial and agricultural vehicles",,https://howtheyvote.eu/api/votes/166073.csv,Transport and Tourism,TRAN,Transport and Tourism
166077,Definition of criminal offences and penalties for the violation of Union restrictive measures,2024-03-12T13:15:38,"Peace preservation, humanitarian and rescue tasks, crisis management; Fundamental freedoms, human rights, democracy in general; Action to combat crime; Judicial cooperation in criminal matters",Russia,https://howtheyvote.eu/api/votes/166077.csv,"Civil Liberties, Justice and Home Affairs",LIBE,"Civil Liberties, Justice and Home Affairs"
166082,Amending certain financial services and investment support regulations as regards certain reporting requirements,2024-03-12T13:30:08,"Securities and financial markets, stock exchange, CIUTS, investments; Banks and credit; Financial services, financial reporting and auditing; Structural funds, investment funds in general, programmes; Agencies and bodies of the EU",,https://howtheyvote.eu/api/votes/166082.csv,Economic and Monetary Affairs,ECON,Economic and Monetary Affairs
166133,Industrial Emissions Portal,2024-03-12T13:15:01,"Public access to information and documents, administrative practice; Environmental policy; Consumer information, advertising, labelling",,https://howtheyvote.eu/api/votes/166133.csv,"Environment, Climate and Food Safety",ENVI,"Environment, Climate and Food Safety"
166146,European Maritime Safety Agency and repealing Regulation (EC) No 1406/2002,2024-03-12T13:41:59,Maritime safety; Agencies and bodies of the EU,,https://howtheyvote.eu/api/votes/166146.csv,Transport and Tourism,TRAN,Transport and Tourism
166177,Horizontal cybersecurity requirements for products with digital elements and amending Regulation (EU) 2019/1020,2024-03-12T13:33:13,"Standardisation, EC/EU standards and trade mark, certification, compliance; Information and communication technologies, digital technologies; Cybersecurity, cyberspace policy; International information networks and society, internet; Safety of products and services, product liability; Export/import control, trade defence, trade barriers",,https://howtheyvote.eu/api/votes/166177.csv,"Industry, Research and Energy",ITRE,"Industry, Research and Energy"
166226,Substantiation and communication of explicit environmental claims (Green Claims Directive),2024-03-12T13:40:42,"Consumer information, advertising, labelling; Consumers' economic and legal interests",,https://howtheyvote.eu/api/votes/166226.csv,"Environment, Climate and Food Safety;Internal Market and Consumer Protection",ENVI;IMCO,"Environment, Climate and Food Safety"
166227,"Use of railway infrastructure capacity in the single European railway area, amending Directive 2012/34/EU and repealing Regulation (EU) No 913/2010",2024-03-12T13:27:29,Rail transport: passengers and freight; Trans-European transport networks,,https://howtheyvote.eu/api/votes/166227.csv,Transport and Tourism,TRAN,Transport and Tourism
166228,"Council decision inviting Member States to ratify the Violence and Harassment Convention, 2019 (No 190) of the International Labour Organization",2024-03-12T13:42:26,"Women condition and rights; Workers protection and rights, labour law; Health and safety at work, occupational medicine; Relations with/in the context of international organisations: UN, OSCE, OECD, Council of Europe, EBRD",,https://howtheyvote.eu/api/votes/166228.csv,Employment and Social Affairs;Women’s Rights and Gender Equality,EMPL;FEMM,Employment and Social Affairs
166249,Industrial Emissions Directive,2024-03-12T13:14:11,"Industrial policy; Atmospheric pollution, motor vehicle pollution; Water control and management, pollution of waterways, water pollution; Soil pollution, deterioration; Waste management, domestic waste, packaging, light industrial waste; Sustainable development",,https://howtheyvote.eu/api/votes/166249.csv,"Environment, Climate and Food Safety",ENVI,"Environment, Climate and Food Safety"
166379,Objection pursuant to Rule 111(3): Union list of projects of common interest and projects of mutual interest,2024-03-12T13:07:48,Trans-European energy networks,,https://howtheyvote.eu/api/votes/166379.csv,"Industry, Research and Energy",ITRE,"Industry, Research and Energy"
164580,Improving the Union’s protection against market manipulation on the wholesale energy market,2024-02-29T12:11:40,"Internal market, single market; Competition; Trade restrictions, concerted practices, dominant positions; Energy policy; Gas, electricity, natural gas, biogas; Alternative and renewable energies; Cooperation and agreements for energy",,https://howtheyvote.eu/api/votes/164580.csv,"Industry, Research and Energy",ITRE,"Industry, Research and Energy"
164581,Implementation of the EU-Southern African Development Community (SADC) Economic Partnership Agreement (EPA),2024-02-29T12:25:50,"Bilateral economic and trade agreements and relations; Relations with ACP countries, conventions and generalities","Botswana, Eswatini, Lesotho, Mozambique, Namibia, South Africa",https://howtheyvote.eu/api/votes/164581.csv,International Trade,INTA,International Trade
164582,Deepening EU integration in view of future enlargement,2024-02-29T12:23:02,Enlargement of the Union,,https://howtheyvote.eu/api/votes/164582.csv,Constitutional Affairs;Foreign Affairs,AFCO;AFET,Constitutional Affairs
164584,Data collection and sharing relating to short-term accommodation rental services,2024-02-29T12:04:55,"Public access to information and documents, administrative practice; Cooperation between administrations; Information and communication technologies, digital technologies; Tourism",,https://howtheyvote.eu/api/votes/164584.csv,Internal Market and Consumer Protection,IMCO,Internal Market and Consumer Protection
164795,EU/Chile Advanced Framework Agreement,2024-02-29T12:05:38,"Bilateral economic and trade agreements and relations; Relations with Latin America, Central America, Caribbean islands",Chile,https://howtheyvote.eu/api/votes/164795.csv,Foreign Affairs;International Trade,AFET;INTA,Foreign Affairs
164796,Conclusion of an Agreement between the European Union and the Republic of Seychelles on access for Seychelles fishing vessels to the waters of Mayotte,2024-02-29T12:04:33,Fisheries agreements with Indian Ocean countries,"Mayotte, Seychelles",https://howtheyvote.eu/api/votes/164796.csv,Fisheries,PECH,Fisheries
164797,Interim Agreement on Trade between the European Union and the Republic of Chile,2024-02-29T12:05:18,"Bilateral economic and trade agreements and relations; Relations with Latin America, Central America, Caribbean islands",Chile,https://howtheyvote.eu/api/votes/164797.csv,International Trade,INTA,International Trade
164961,"Economic Partnership Agreement between the European Union of the one part, and Republic of Kenya, Member of the East African Community of the other part",2024-02-29T12:04:10,Bilateral economic and trade agreements and relations,Kenya,https://howtheyvote.eu/api/votes/164961.csv,International Trade,INTA,International Trade
165939,The murder of Alexei Navalny and the need for EU action in support of political prisoners and oppressed civil society in Russia,2024-02-29T12:14:59,"Fundamental freedoms, human rights, democracy in general",Russia,https://howtheyvote.eu/api/votes/165939.csv,,,
165965,"The need for unwavering EU support for Ukraine, after two years of Russia´s war of aggression against Ukraine",2024-02-29T12:19:52,"Third-country political situation, local and regional conflicts","Russia, Ukraine",https://howtheyvote.eu/api/votes/165965.csv,,,
165987,Critical situation in Cuba,2024-02-29T12:29:44,"Third-country political situation, local and regional conflicts; Human rights situation in the world",Cuba,https://howtheyvote.eu/api/votes/165987.csv,,,
165988,EU/Chile Advanced Framework Agreement (resolution),2024-02-29T12:08:46,"Bilateral economic and trade agreements and relations; Relations with Latin America, Central America, Caribbean islands",Chile,https://howtheyvote.eu/api/votes/165988.csv,Foreign Affairs;International Trade,AFET;INTA,Foreign Affairs
165993,European Digital Identity Framework,2024-02-29T12:12:53,"Public access to information and documents, administrative practice; Protection of privacy and data protection; Electronic money and payments, cross-border credit transfers; Cooperation between administrations; Electronic and mobile communications, personal communications; Information and communication technologies, digital technologies; International information networks and society, internet; Business policy, e-commerce, after-sales service, commercial distribution; Consumers' economic and legal interests; Safety of products and services, product liability",,https://howtheyvote.eu/api/votes/165993.csv,"Industry, Research and Energy",ITRE,"Industry, Research and Energy"
164524,Financial activities of the European Investment Bank - annual report 2023,2024-02-28T18:20:52,European Investment Bank (EIB),,https://howtheyvote.eu/api/votes/164524.csv,Budgets,BUDG,Budgets
164530,Faster and Safer Relief of Excess Withholding Taxes,2024-02-28T13:01:55,Free movement of capital; Taxation,,https://howtheyvote.eu/api/votes/164530.csv,Economic and Monetary Affairs,ECON,Economic and Monetary Affairs
164532,"Geographical Indications for wine, spirit drinks and agricultural products",2024-02-28T13:00:04,"Standardisation, EC/EU standards and trade mark, certification, compliance; Marketing and trade of agricultural products and livestock; Wine, alcoholic and non-alcoholic beverages; Foodstuffs, foodstuffs legislation; Consumer information, advertising, labelling",,https://howtheyvote.eu/api/votes/164532.csv,Agriculture and Rural Development,AGRI,Agriculture and Rural Development
164555,Report on the Commission’s 2023 Rule of Law report,2024-02-28T18:25:54,"Principles common to the Member States, EU values",,https://howtheyvote.eu/api/votes/164555.csv,"Civil Liberties, Justice and Home Affairs",LIBE,"Civil Liberties, Justice and Home Affairs"
164578,Ongoing negotiations on a status agreement on operational activities carried out by the European Border and Coast Guard Agency (Frontex) in Senegal,2024-02-28T13:12:58,"External borders crossing and controls, visas",Senegal,https://howtheyvote.eu/api/votes/164578.csv,"Civil Liberties, Justice and Home Affairs",LIBE,"Civil Liberties, Justice and Home Affairs"
164600,Supplementary protection certificate for medicinal products (recast),2024-02-28T12:51:57,"Research specific areas; Industrial property, European patent, Community patent, design and pattern; Health legislation and policy",,https://howtheyvote.eu/api/votes/164600.csv,Legal Affairs,JURI,Legal Affairs
164601,Reporting requirements,2024-02-28T13:02:12,"Standardisation, EC/EU standards and trade mark, certification, compliance; Aquaculture; Fishing industry and statistics, fishery products; Motor industry, cycle and motorcycle, commercial and agricultural vehicles",,https://howtheyvote.eu/api/votes/164601.csv,Internal Market and Consumer Protection,IMCO,Internal Market and Consumer Protection
164605,Supplementary protection certificate for plant protection products (recast),2024-02-28T12:51:22,"Plant health legislation; Industrial property, European patent, Community patent, design and pattern",,https://howtheyvote.eu/api/votes/164605.csv,Legal Affairs,JURI,Legal Affairs
164612,Unitary supplementary certificate for medicinal products,2024-02-28T12:50:45,"Intellectual property, copyright; Industrial property, European patent, Community patent, design and pattern; Pharmaceutical products and industry",,https://howtheyvote.eu/api/votes/164612.csv,Legal Affairs,JURI,Legal Affairs
164659,Human rights and democracy in the world and the European Union’s policy on the matter – annual report 2023,2024-02-28T18:18:48,Human rights situation in the world,,https://howtheyvote.eu/api/votes/164659.csv,Foreign Affairs,AFET,Foreign Affairs
164705,Unitary supplementary protection certificate for plant protection products,2024-02-28T12:49:40,"Plant health legislation; Intellectual property, copyright; Industrial property, European patent, Community patent, design and pattern",,https://howtheyvote.eu/api/votes/164705.csv,Legal Affairs,JURI,Legal Affairs
164794,Implementation of the common security and defence policy – annual report 2023,2024-02-28T18:05:57,"Common security and defence policy (CSDP); WEU, NATO",,https://howtheyvote.eu/api/votes/164794.csv,Foreign Affairs,AFET,Foreign Affairs
164839,"Recommendation to the Council, the Commission and the EEAS on the situation in Syria",2024-02-28T18:31:23,"Third-country political situation, local and regional conflicts",Syria,https://howtheyvote.eu/api/votes/164839.csv,Foreign Affairs,AFET,Foreign Affairs
164958,Implementation of the common foreign and security policy – annual report 2023,2024-02-28T17:48:05,Common foreign and security policy (CFSP),,https://howtheyvote.eu/api/votes/164958.csv,Foreign Affairs,AFET,Foreign Affairs
165088,Driving licences,2024-02-28T12:46:58,"Transport regulations, road safety, roadworthiness tests, driving licence",,https://howtheyvote.eu/api/votes/165088.csv,Transport and Tourism,TRAN,Transport and Tourism
165167,Standard essential patents,2024-02-28T12:59:42,"Standardisation, EC/EU standards and trade mark, certification, compliance; Industrial property, European patent, Community patent, design and pattern",,https://howtheyvote.eu/api/votes/165167.csv,Legal Affairs,JURI,Legal Affairs
164462,Protection of the environment through criminal law,2024-02-27T12:31:38,"Law and environment, liability",,https://howtheyvote.eu/api/votes/164462.csv,Legal Affairs,JURI,Legal Affairs
164464,Transparency and targeting of political advertising,2024-02-27T12:30:08,"Protection of privacy and data protection; Free movement of services, freedom to provide; Consumer information, advertising, labelling",,https://howtheyvote.eu/api/votes/164464.csv,Internal Market and Consumer Protection,IMCO,Internal Market and Consumer Protection
164466,Amendments to Protocol No 3 on the Statute of the Court of Justice,2024-02-27T12:23:28,"Court of Justice, Court of First Instance",,https://howtheyvote.eu/api/votes/164466.csv,Legal Affairs,JURI,Legal Affairs
164468,Certain aspects of the minimum requirement for own funds and eligible liabilities,2024-02-27T12:26:42,"Securities and financial markets, stock exchange, CIUTS, investments; Banks and credit; Financial services, financial reporting and auditing; Financial supervision",,https://howtheyvote.eu/api/votes/164468.csv,Economic and Monetary Affairs,ECON,Economic and Monetary Affairs
164486,European Central Bank – annual report 2023,2024-02-27T12:35:39,"European Central Bank (ECB), ESCB",,https://howtheyvote.eu/api/votes/164486.csv,Economic and Monetary Affairs,ECON,Economic and Monetary Affairs
164487,Detergents and surfactants,2024-02-27T12:30:36,"Standardisation, EC/EU standards and trade mark, certification, compliance; Chemical industry, fertilizers, plastics; Water control and management, pollution of waterways, water pollution; Dangerous substances, toxic and radioactive wastes (storage, transport); Consumer information, advertising, labelling; Safety of products and services, product liability; Export/import control, trade defence, trade barriers",,https://howtheyvote.eu/api/votes/164487.csv,"Environment, Climate and Food Safety",ENVI,"Environment, Climate and Food Safety"
164489,Establishing the Strategic Technologies for Europe Platform (‘STEP’),2024-02-27T12:16:17,"Structural funds, investment funds in general, programmes; Budget of the Union; Financing of the budget, own resources",,https://howtheyvote.eu/api/votes/164489.csv,"Budgets;Industry, Research and Energy",BUDG;ITRE,Budgets
164491,Amending Decision (EU) 2017/1324: continuation of the Union’s participation in PRIMA under Horizon Europe,2024-02-27T12:31:09,Framework programme and research programmes; Innovation,,https://howtheyvote.eu/api/votes/164491.csv,"Industry, Research and Energy",ITRE,"Industry, Research and Energy"
164493,Shipments of waste,2024-02-27T12:26:12,"Waste management, domestic waste, packaging, light industrial waste; Dangerous substances, toxic and radioactive wastes (storage, transport); International and regional environment protection measures and agreements",,https://howtheyvote.eu/api/votes/164493.csv,"Environment, Climate and Food Safety",ENVI,"Environment, Climate and Food Safety"
164499,Nature restoration,2024-02-27T12:28:30,"Environmental policy; Protection of natural resources: fauna, flora, nature, wildlife, countryside; biodiversity",,https://howtheyvote.eu/api/votes/164499.csv,"Environment, Climate and Food Safety",ENVI,"Environment, Climate and Food Safety"
164515,Protection of journalists and human rights defenders from manifestly unfounded or abusive court proceedings,2024-02-27T12:20:41,"Press, media freedom and pluralism; Judicial cooperation in civil and commercial matters; Principles common to the Member States, EU values",,https://howtheyvote.eu/api/votes/164515.csv,Legal Affairs,JURI,Legal Affairs
